{
  "$schema": "https://json-schema.org/draft/2020-12/schema",
  "$id": "https://teploy.github.io/contracts/schema/app-list-envelope.schema.json",
  "title": "teploy app list --json (MI 1 appListDTO)",
  "type": "object",
  "required": [
    "machine_interface",
    "host",
    "apps",
    "observed_at",
    "errors"
  ],
  "properties": {
    "machine_interface": {
      "type": "integer",
      "minimum": 1
    },
    "host": {
      "type": "string"
    },
    "apps": {
      "type": "array",
      "items": {
        "$ref": "#/$defs/appStatus"
      }
    },
    "observed_at": {
      "type": "string",
      "format": "date-time"
    },
    "errors": {
      "type": "array",
      "items": {
        "$ref": "#/$defs/machineError"
      }
    },
    "undeployed": {
      "type": "array",
      "description": "Only with --include-undeployed (capability undeployed-list-v1): Teploy-home apps with a v3 tombstone (never deployed, or removed with their config kept). Absent otherwise.",
      "items": {
        "$ref": "#/$defs/undeployedApp"
      }
    }
  },
  "$defs": {
    "machineError": {
      "type": "object",
      "required": [
        "scope",
        "message"
      ],
      "properties": {
        "scope": {
          "type": "string"
        },
        "message": {
          "type": "string"
        }
      }
    },
    "container": {
      "type": "object",
      "required": [
        "id",
        "name",
        "image",
        "state",
        "status"
      ],
      "properties": {
        "id": {
          "type": "string"
        },
        "name": {
          "type": "string"
        },
        "image": {
          "type": "string"
        },
        "image_id": {
          "type": "string",
          "description": "Set only for a container created by image ID: the full sha256 image ID. image then carries the first repo tag (or the ID when untagged/unresolvable)."
        },
        "image_tags": {
          "type": "array",
          "items": {
            "type": "string"
          }
        },
        "state": {
          "type": "string"
        },
        "status": {
          "type": "string"
        },
        "created_at": {
          "type": "string"
        },
        "process": {
          "type": "string"
        },
        "version": {
          "type": "string"
        }
      }
    },
    "release": {
      "type": "object",
      "required": [
        "version",
        "ports"
      ],
      "properties": {
        "version": {
          "type": "string"
        },
        "ports": {
          "type": "array",
          "items": {
            "type": "integer"
          }
        }
      }
    },
    "appStatus": {
      "type": "object",
      "required": [
        "app",
        "domain",
        "type",
        "ingress",
        "current_release",
        "previous_release",
        "containers",
        "processes",
        "lock",
        "maintenance",
        "observed_at",
        "errors"
      ],
      "properties": {
        "app": {
          "type": "string"
        },
        "domain": {
          "type": "string"
        },
        "type": {
          "type": "string"
        },
        "ingress": {
          "type": "string"
        },
        "current_release": {
          "$ref": "#/$defs/release"
        },
        "previous_release": {
          "$ref": "#/$defs/release"
        },
        "containers": {
          "type": "array",
          "items": {
            "$ref": "#/$defs/container"
          }
        },
        "processes": {
          "type": "array"
        },
        "lock": {
          "type": [
            "object",
            "null"
          ]
        },
        "maintenance": {
          "type": "boolean"
        },
        "observed_at": {
          "type": "string",
          "format": "date-time"
        },
        "errors": {
          "type": "array",
          "items": {
            "$ref": "#/$defs/machineError"
          }
        }
      }
    },
    "undeployedApp": {
      "type": "object",
      "required": [
        "app",
        "generation",
        "updated_at"
      ],
      "properties": {
        "app": {
          "type": "string",
          "minLength": 1
        },
        "domain": {
          "type": "string"
        },
        "generation": {
          "type": "integer",
          "minimum": 1
        },
        "updated_at": {
          "type": "string",
          "format": "date-time"
        }
      }
    }
  }
}
