{
  "machine_interface": 2,
  "host": "srv.example.com",
  "apps": [
    {
      "app": "myapp",
      "domain": "myapp.example.com",
      "type": "container",
      "ingress": "caddy",
      "current_release": {
        "version": "3",
        "ports": [
          3000
        ]
      },
      "previous_release": {
        "version": "2",
        "ports": [
          3000
        ]
      },
      "containers": [
        {
          "id": "9f31c02",
          "name": "myapp-web-3",
          "image": "nginx:1.27",
          "state": "running",
          "status": "Up 4 minutes",
          "created_at": "2026-09-23T11:55:00Z",
          "process": "web",
          "version": "3"
        }
      ],
      "processes": [],
      "lock": null,
      "maintenance": false,
      "observed_at": "2026-09-23T12:00:00Z",
      "errors": []
    }
  ],
  "observed_at": "2026-09-23T12:00:00Z",
  "errors": []
}
